{
  "discovery": {
    "bytes": 2102833,
    "line": "2102833 787964f8f06061cb63bf1e4e3a125936 http://data.gdeltproject.org/gdeltv2/20260905221500.gkg.csv.zip",
    "md5": "787964f8f06061cb63bf1e4e3a125936",
    "sha256": "55b442e4a5b8baecea30a4f398ff340958a100270bf29b84bab65176f8773e39",
    "url": "http://data.gdeltproject.org/gdeltv2/20260905221500.gkg.csv.zip"
  },
  "errors": [],
  "members": [
    {
      "compressed_bytes": 2102639,
      "name": "20260905221500.gkg.csv",
      "uncompressed_bytes": 6456954
    }
  ],
  "schema_version": "1.0.0",
  "sha256": "df4305ae9f18ee73cc84241c7b5e18b56c754dd051000df58f1feb01ca74c402",
  "source_id": "gdelt-gkg-2.1",
  "source_reference": "http://data.gdeltproject.org/gdeltv2/20260905221500.gkg.csv.zip",
  "statistics": {
    "bad_rows": 0,
    "complete": true,
    "date_counts": {
      "20260905221500": 479
    },
    "empty_theme_rows": 76,
    "field_count_distribution": {
      "27": 479
    },
    "row_error_counts": {},
    "rows": 479,
    "theme_counts": {
      "ACT_MAKESTATEMENT": 2,
      "AFFECT": 68,
      "AGRICULTURE": 17,
      "AID_HUMANITARIAN": 4,
      "ALLIANCE": 5,
      "APPOINTMENT": 12,
      "ARMEDCONFLICT": 68,
      "ARREST": 41,
      "AVIATION_INCIDENT": 2,
      "BAN": 13,
      "BLOCKADE": 5,
      "BORDER": 15,
      "BULLYING": 7,
      "CEASEFIRE": 6,
      "CHARASMATIC_LEADERSHIP": 1,
      "CHECKPOINT": 1,
      "CLOSURE": 11,
      "CONFISCATION": 1,
      "CONSTITUTIONAL": 7,
      "CORRUPTION": 10,
      "CRIME_CARTELS": 5,
      "CRIME_COMMON_ROBBERY": 7,
      "CRIME_ILLEGAL_DRUGS": 7,
      "CRISISLEX_C01_CHILDREN_AND_EDUCATION": 2,
      "CRISISLEX_C03_WELLBEING_HEALTH": 72,
      "CRISISLEX_C04_LOGISTICS_TRANSPORT": 37,
      "CRISISLEX_C05_NEED_OF_SHELTERS": 4,
      "CRISISLEX_C06_WATER_SANITATION": 9,
      "CRISISLEX_C07_SAFETY": 123,
      "CRISISLEX_CRISISLEXREC": 193,
      "CRISISLEX_O01_WEATHER": 23,
      "CRISISLEX_O02_RESPONSEAGENCIESATCRISIS": 17,
      "CRISISLEX_T01_CAUTION_ADVICE": 43,
      "CRISISLEX_T02_INJURED": 72,
      "CRISISLEX_T03_DEAD": 71,
      "CRISISLEX_T04_INFRASTRUCTURE": 14,
      "CRISISLEX_T06_SUPPLIES": 2,
      "CRISISLEX_T07_SERVICESNEEDEDOFFERED": 3,
      "CRISISLEX_T08_MISSINGFOUNDTRAPPEDPEOPLE": 9,
      "CRISISLEX_T09_DISPLACEDRELOCATEDEVACUATED": 8,
      "CRISISLEX_T11_UPDATESSYMPATHY": 82,
      "CYBER_ATTACK": 10,
      "DEATH_PENALTY": 2,
      "DEFECTION": 1,
      "DELAY": 43,
      "DEMOCRACY": 9,
      "DISABILITY": 4,
      "DISASTER_FIRE": 18,
      "DISCRIMINATION": 11,
      "DISCRIMINATION_IMMIGRATION": 1,
      "DISCRIMINATION_IMMIGRATION_ULTRANATIONALIST": 1,
      "DISCRIMINATION_LGBT": 2,
      "DISCRIMINATION_LGBT_ANTIGAY": 1,
      "DISCRIMINATION_LGBT_HOMOPHOBIA": 1,
      "DISCRIMINATION_RACE": 5,
      "DISCRIMINATION_RACE_RACISM": 2,
      "DISCRIMINATION_RACE_RACIST": 4,
      "DISCRIMINATION_RELIGION": 1,
      "DISCRIMINATION_RELIGION_ISLAMOPHOBIA": 1,
      "DISPLACED": 4,
      "DRONES": 16,
      "DRUG_TRADE": 10,
      "ECON_BOYCOTT": 1,
      "ECON_BUDGET_DEFICIT": 5,
      "ECON_COST_OF_LIVING": 3,
      "ECON_DEBT": 8,
      "ECON_DEVELOPMENTORGS": 4,
      "ECON_DEVELOPMENTORGS_UNITED_NATIONS_ENVIRONMENT_PROGRAMME": 1,
      "ECON_DEVELOPMENTORGS_WORLD_BANK": 2,
      "ECON_DEVELOPMENTORGS_WORLD_FOOD_PROGRAMME": 1,
      "ECON_ELECTRICALDEMAND": 1,
      "ECON_ELECTRICALPRICE": 1,
      "ECON_ENTREPRENEURSHIP": 4,
      "ECON_FOREIGNINVEST": 1,
      "ECON_GASOLINEPRICE": 2,
      "ECON_HEATINGOIL": 1,
      "ECON_HOUSING_PRICES": 4,
      "ECON_INFLATION": 4,
      "ECON_INTEREST_RATES": 3,
      "ECON_MONEYLAUNDERING": 1,
      "ECON_MOU": 4,
      "ECON_OILPRICE": 6,
      "ECON_SOVEREIGN_DEBT": 2,
      "ECON_STOCKMARKET": 22,
      "ECON_TAXATION": 11,
      "ECON_TRADE_DISPUTE": 1,
      "ECON_UNIONS": 2,
      "ECON_WORKINGCLASS": 1,
      "ECON_WORLDCURRENCIES": 5,
      "ECON_WORLDCURRENCIES_DOLLARS": 3,
      "ECON_WORLDCURRENCIES_HUNGARIAN_FORINTS": 2,
      "EDUCATION": 66,
      "ELECTION": 18,
      "ELECTION_FRAUD": 1,
      "EMERG_EMERGSHELTER": 1,
      "ENV_CLIMATECHANGE": 6,
      "ENV_COAL": 1,
      "ENV_GREEN": 2,
      "ENV_HYDRO": 2,
      "ENV_METALS": 1,
      "ENV_MINING": 3,
      "ENV_NATURALGAS": 3,
      "ENV_OIL": 31,
      "ENV_SOLAR": 1,
      "ENV_SPECIESENDANGERED": 1,
      "ENV_WATERWAYS": 4,
      "EPU_CATS_ENTITLEMENT_PROGRAMS": 2,
      "EPU_CATS_FISCAL_POLICY": 1,
      "EPU_CATS_MIGRATION_FEAR_FEAR": 54,
      "EPU_CATS_MIGRATION_FEAR_MIGRATION": 8,
      "EPU_CATS_MONETARY_POLICY": 3,
      "EPU_CATS_NATIONAL_SECURITY": 53,
      "EPU_CATS_REGULATION": 30,
      "EPU_CATS_SOVEREIGN_DEBT_CURRENCY_CRISES": 1,
      "EPU_CATS_TAXES": 12,
      "EPU_CATS_TRADE_POLICY": 7,
      "EPU_ECONOMY": 44,
      "EPU_ECONOMY_HISTORIC": 94,
      "EPU_POLICY": 166,
      "EPU_POLICY_AUTHORITIES": 32,
      "EPU_POLICY_BUDGET": 14,
      "EPU_POLICY_CONGRESS": 16,
      "EPU_POLICY_CONGRESSIONAL": 3,
      "EPU_POLICY_DEFICIT": 1,
      "EPU_POLICY_FEDERAL_RESERVE": 1,
      "EPU_POLICY_GOVERNMENT": 71,
      "EPU_POLICY_INTEREST_RATE": 1,
      "EPU_POLICY_INTEREST_RATES": 1,
      "EPU_POLICY_LAW": 27,
      "EPU_POLICY_LAWMAKERS": 1,
      "EPU_POLICY_LEGISLATION": 7,
      "EPU_POLICY_MINISTRY_OF_FINANCE": 1,
      "EPU_POLICY_MONETARY_POLICY": 1,
      "EPU_POLICY_POLICY": 26,
      "EPU_POLICY_POLITICAL": 34,
      "EPU_POLICY_REFORM": 6,
      "EPU_POLICY_REGULATION": 3,
      "EPU_POLICY_REGULATORY": 1,
      "EPU_POLICY_SPENDING": 18,
      "EPU_POLICY_TAX": 11,
      "EPU_POLICY_WHITE_HOUSE": 13,
      "EPU_UNCERTAINTY": 14,
      "ETH_INDIGINOUS": 6,
      "EVACUATION": 6,
      "EXILE": 3,
      "EXTREMISM": 17,
      "FOOD_SECURITY": 1,
      "FREESPEECH": 1,
      "FUELPRICES": 5,
      "GENDER_VIOLENCE": 3,
      "GENERAL_GOVERNMENT": 85,
      "GENERAL_HEALTH": 76,
      "GEN_HOLIDAY": 14,
      "GOV_LOCALGOV": 13,
      "GOV_REPATRIATION": 4,
      "GRIEVANCES": 3,
      "HATE_SPEECH": 2,
      "HEALTH_PANDEMIC": 3,
      "HEALTH_SEXTRANSDISEASE": 1,
      "HUMAN_RIGHTS_ABUSES": 2,
      "HUMAN_RIGHTS_ABUSES_TORTURE": 1,
      "HUMAN_RIGHTS_ABUSES_TORTURED": 1,
      "HUMAN_TRAFFICKING": 1,
      "IDEOLOGY": 13,
      "IMMIGRATION": 8,
      "IMPEACHMENT": 1,
      "INEQUALITY": 2,
      "INFO_RUMOR": 7,
      "INFRASTRUCTURE_BAD_ROADS": 1,
      "JIHAD": 2,
      "JUSTICE": 3,
      "KIDNAP": 6,
      "KILL": 90,
      "LEADER": 89,
      "LEGISLATION": 38,
      "LGBT": 3,
      "MANMADE_DISASTER": 18,
      "MANMADE_DISASTER_ABANDON_SHIP": 3,
      "MANMADE_DISASTER_BRIDGE_COLLAPSE": 1,
      "MANMADE_DISASTER_CAR_ACCIDENT": 1,
      "MANMADE_DISASTER_CAR_CRASH": 2,
      "MANMADE_DISASTER_ENGINE_FAILURE": 1,
      "MANMADE_DISASTER_IMPLIED": 117,
      "MANMADE_DISASTER_PLANE_CRASH": 1,
      "MANMADE_DISASTER_POWER_OUTAGES": 2,
      "MANMADE_DISASTER_STRUCTURAL_FAILURE": 5,
      "MANMADE_DISASTER_TRAFFIC_COLLISION": 1,
      "MANMADE_DISASTER_WITHOUT_POWER": 1,
      "MARITIME": 35,
      "MARITIME_INCIDENT": 16,
      "MARITIME_PIRACY": 3,
      "MEDIA_CENSORSHIP": 3,
      "MEDIA_MSM": 72,
      "MEDIA_SOCIAL": 36,
      "MEDICAL": 72,
      "MILITARY": 32,
      "MIL_MERCENARIES": 1,
      "MIL_WEAPONS_PROLIFERATION": 2,
      "MOVEMENT_GENERAL": 18,
      "MOVEMENT_WOMENS": 2,
      "NATURAL_DISASTER": 31,
      "NATURAL_DISASTER_BLIZZARD": 1,
      "NATURAL_DISASTER_CHILL": 2,
      "NATURAL_DISASTER_DROUGHT": 1,
      "NATURAL_DISASTER_DROWNING": 2,
      "NATURAL_DISASTER_EARTHQUAKE": 1,
      "NATURAL_DISASTER_EARTHQUAKES": 1,
      "NATURAL_DISASTER_EROSION": 2,
      "NATURAL_DISASTER_ERUPTIONS": 1,
      "NATURAL_DISASTER_EXTREME_WEATHER": 2,
      "NATURAL_DISASTER_FLASH_FLOODS": 3,
      "NATURAL_DISASTER_FLOOD": 2,
      "NATURAL_DISASTER_FLOODED": 3,
      "NATURAL_DISASTER_FLOODING": 1,
      "NATURAL_DISASTER_FLOODS": 4,
      "NATURAL_DISASTER_HEAT_WAVE": 1,
      "NATURAL_DISASTER_HEAVY_RAIN": 1,
      "NATURAL_DISASTER_HEAVY_SNOW": 1,
      "NATURAL_DISASTER_HEAVY_SNOWFALL": 1,
      "NATURAL_DISASTER_HURRICANE": 1,
      "NATURAL_DISASTER_ICE": 8,
      "NATURAL_DISASTER_ICY": 2,
      "NATURAL_DISASTER_LANDSLIDE": 1,
      "NATURAL_DISASTER_MONSOON": 1,
      "NATURAL_DISASTER_RICHTER_SCALE": 1,
      "NATURAL_DISASTER_SEVERE_WEATHER": 1,
      "NATURAL_DISASTER_SNOWSTORM": 2,
      "NATURAL_DISASTER_STORM_SYSTEM": 1,
      "NATURAL_DISASTER_TORNADO": 1,
      "NATURAL_DISASTER_TORNADOES": 1,
      "NATURAL_DISASTER_TREMORS": 1,
      "NATURAL_DISASTER_WILDFIRE": 1,
      "NATURAL_DISASTER_WINTER_STORM": 1,
      "NEGOTIATIONS": 14,
      "NEW_CONSTRUCTION": 3,
      "ORGANIZED_CRIME": 7,
      "PEACEKEEPING": 1,
      "PERSECUTION": 2,
      "POLITICAL_PRISONER": 1,
      "POVERTY": 3,
      "POWER_OUTAGE": 3,
      "PROPAGANDA": 3,
      "PROTEST": 17,
      "PUBLIC_TRANSPORT": 11,
      "RAPE": 4,
      "RATIFY": 3,
      "REBELLION": 1,
      "REBELS": 1,
      "RECRUITMENT": 11,
      "REFUGEES": 3,
      "RELEASE_HOSTAGE": 1,
      "RELIGION": 11,
      "REL_ISLAMOPHOBIA": 1,
      "RESIGNATION": 2,
      "RETALIATE": 6,
      "RETIREMENT": 5,
      "RETIREMENTS": 2,
      "ROAD_INCIDENT": 5,
      "RURAL": 2,
      "SANCTIONS": 10,
      "SANITATION": 1,
      "SCANDAL": 6,
      "SCIENCE": 19,
      "SECURITY_SERVICES": 76,
      "SEIGE": 7,
      "SEIZE": 14,
      "SELF_IDENTIFIED_ATROCITY": 5,
      "SELF_IDENTIFIED_HUMANITARIAN_CRISIS": 2,
      "SELF_IDENTIFIED_HUMAN_RIGHTS": 8,
      "SHORTAGE": 11,
      "SLFID_DICTATORSHIP": 1,
      "SLFID_ECONOMIC_DEVELOPMENT": 1,
      "SLFID_NATURAL_RESOURCES": 3,
      "SMUGGLING": 2,
      "SOC_BURIALPRACTICES": 1,
      "SOC_DIPLOMRECOG": 1,
      "SOC_EXPRESSREGRET": 5,
      "SOC_EXPRESSSUPPORT": 1,
      "SOC_FASCISM": 1,
      "SOC_GENERALCRIME": 47,
      "SOC_INNOVATION": 6,
      "SOC_POINTSOFINTEREST": 109,
      "SOC_POINTSOFINTEREST_AIRPORT": 16,
      "SOC_POINTSOFINTEREST_AIRPORTS": 14,